{"schema_version":"1.0.0","protocol_version":"1.2","candidate_id":"candidate-1","revision_hash":"aaaaaaaaaaaaaaaaaaaaaaaaaaaaaaaaaaaaaaaaaaaaaaaaaaaaaaaaaaaaaaaa","correlation_id":"review-1","idempotency_key":"evaluation-1","deterministic_pass":true,"alignment_decision":"allow","blind":true,"proposal_context_visible":false,"replays":[{"fixture":"a","baseline_pass":true,"candidate_pass":true,"judge":"candidate","critical_regression":false},{"fixture":"b","baseline_pass":false,"candidate_pass":true,"judge":"candidate","critical_regression":false},{"fixture":"c","baseline_pass":true,"candidate_pass":true,"judge":"tie","critical_regression":false}],"decision":"pass","candidate_wins":2,"evidence_hashes":["fixture-set-1"]}
